{
  "format": "set-calculus-provenance/v1",
  "generated_from": [
    "README.md",
    "docs/intent-driven-generative-math/README.md",
    "docs/intent-driven-generative-math/PRIMITIVES.md",
    "docs/intent-driven-generative-math/INTENT.md",
    "docs/intent-driven-generative-math/AXIOMS_AND_LAWS.md",
    "docs/causal-reality-calculus/CORE_PRIMITIVES_AND_AXIOMS.md",
    "docs/causal-reality-calculus/SOURCE_LEDGER.md",
    "docs/causal-reality-calculus/PROVENANCE_MATRIX.md",
    "docs/causal-reality-calculus/REVERSE_SOURCE_INDEX.md",
    "docs/causal-reality-calculus/COVERAGE_AUDIT.md"
  ],
  "sources": [
    {
      "id": "gr-ai-gamma:artifact:set-calculus-readme",
      "name": "Set Calculus README",
      "aliases": [],
      "kind": "REPOSITORY_ARTIFACT",
      "locator": "README.md",
      "repository_ref": "causal-reality-calculus",
      "content_sha": "4ab3be5567cef7d1ef47bea44512a1218d2e207b",
      "version": null,
      "author": null,
      "date": null,
      "epistemic_status": "OBSERVED",
      "capture_status": "FULL",
      "notes": [
        "Repository-level statement of purpose, core pipeline, and milestone direction."
      ]
    },
    {
      "id": "gr-ai-gamma:artifact:idgm-readme",
      "name": "Intent-Driven Generative Math README",
      "aliases": [
        "IDGM README"
      ],
      "kind": "REPOSITORY_ARTIFACT",
      "locator": "docs/intent-driven-generative-math/README.md",
      "repository_ref": "causal-reality-calculus",
      "content_sha": "3bf8c42a32f79710a76e8ec22dc53c9ad676d835",
      "version": null,
      "author": null,
      "date": null,
      "epistemic_status": "OBSERVED",
      "capture_status": "FULL",
      "notes": [
        "Defines IDGM as a specialization of Set Calculus."
      ]
    },
    {
      "id": "gr-ai-gamma:artifact:idgm-primitives",
      "name": "IDGM Primitive Boundary",
      "aliases": [],
      "kind": "REPOSITORY_ARTIFACT",
      "locator": "docs/intent-driven-generative-math/PRIMITIVES.md",
      "repository_ref": "causal-reality-calculus",
      "content_sha": "fabaf5223d423d491f191d9f74143afffc0371c2",
      "version": null,
      "author": null,
      "date": null,
      "epistemic_status": "OBSERVED",
      "capture_status": "FULL",
      "notes": [
        "Primary repository source for the inherited Set Calculus primitive tuple and IDGM specialization primitives."
      ]
    },
    {
      "id": "gr-ai-gamma:artifact:idgm-intent",
      "name": "Intent and Intent Delta",
      "aliases": [],
      "kind": "REPOSITORY_ARTIFACT",
      "locator": "docs/intent-driven-generative-math/INTENT.md",
      "repository_ref": "causal-reality-calculus",
      "content_sha": "b6e7a2004ec2cc8fd83370af82510f0d272572ca",
      "version": null,
      "author": null,
      "date": null,
      "epistemic_status": "OBSERVED",
      "capture_status": "FULL",
      "notes": [
        "Primary source for Intent identity, versioning, semantic delta, and supersession."
      ]
    },
    {
      "id": "gr-ai-gamma:artifact:idgm-axioms-laws",
      "name": "IDGM Axioms and Laws",
      "aliases": [],
      "kind": "REPOSITORY_ARTIFACT",
      "locator": "docs/intent-driven-generative-math/AXIOMS_AND_LAWS.md",
      "repository_ref": "causal-reality-calculus",
      "content_sha": "9530d3a3d32df8b5651422826e550e95d81ec70a",
      "version": null,
      "author": null,
      "date": null,
      "epistemic_status": "OBSERVED",
      "capture_status": "PARTIAL",
      "notes": [
        "Primary source for IDGM formal axioms and derived laws. Passage-level extraction still pending."
      ]
    },
    {
      "id": "gr-ai-gamma:artifact:crc-core-primitives-axioms",
      "name": "Causal Reality Calculus Core Primitives and Axioms",
      "aliases": [
        "CRC Core"
      ],
      "kind": "REPOSITORY_ARTIFACT",
      "locator": "docs/causal-reality-calculus/CORE_PRIMITIVES_AND_AXIOMS.md",
      "repository_ref": "causal-reality-calculus",
      "content_sha": "2b56d72682bb67d5f7e6bac3e74b0d1e1a816e24",
      "version": null,
      "author": null,
      "date": null,
      "epistemic_status": "OBSERVED",
      "capture_status": "FULL",
      "notes": [
        "Contains initial CRC synthesis plus source-derived CTE extensions."
      ]
    },
    {
      "id": "gr-ai-gamma:artifact:causal-temporal-economics-v6",
      "name": "Causal Temporal Economics Version 6",
      "aliases": [
        "CTE V6",
        "ct_temporal_economics_en_v6.pdf"
      ],
      "kind": "EXTERNAL_ARTIFACT",
      "locator": "ct_temporal_economics_en_v6.pdf",
      "repository_ref": null,
      "content_sha": null,
      "version": "6 - Cumulative Edition",
      "author": "S. D. Bolduc",
      "date": "2026-09-09",
      "epistemic_status": "OBSERVED",
      "capture_status": "FULL",
      "notes": [
        "External source currently used by CRC provenance records."
      ]
    },
    {
      "id": "gr-ai-gamma:artifact:causal-cartesian-plane-bundle",
      "name": "Causal Cartesian Plane ALL-IN-ONE V2",
      "aliases": [
        "CAUSAL_CARTESIAN_PLANE_ALL_IN_ONE_V2_20260921.zip"
      ],
      "kind": "EXTERNAL_ARTIFACT",
      "locator": "CAUSAL_CARTESIAN_PLANE_ALL_IN_ONE_V2_20260921.zip",
      "repository_ref": null,
      "content_sha": null,
      "version": "V2",
      "author": null,
      "date": "2026-09-21",
      "epistemic_status": "OBSERVED",
      "capture_status": "PARTIAL",
      "notes": [
        "Earlier CRC extraction source for problem-local grids, identity boundaries, metric/address firewall, certified bridges, mirror/inverse distinction, and fail-closed behavior.",
        "Exact passage-level records still need to be registered."
      ]
    },
    {
      "id": "gr-ai-gamma:artifact:set-calculus-plan",
      "name": "Set Calculus Working Plan",
      "aliases": [],
      "kind": "REPOSITORY_ARTIFACT",
      "locator": "PLAN.md",
      "repository_ref": "causal-reality-calculus",
      "content_sha": "e14dcdfd56d2972a56d4bc5b0161afb7270f088f",
      "version": null,
      "author": null,
      "date": null,
      "epistemic_status": "OBSERVED",
      "capture_status": "FULL",
      "notes": [
        "Working implementation direction; not a frozen specification."
      ]
    },
    {
      "id": "gr-ai-gamma:artifact:set-calculus-scope-v0-1",
      "name": "Set Calculus v0.1 Scope",
      "aliases": [
        "SCOPE.md"
      ],
      "kind": "REPOSITORY_ARTIFACT",
      "locator": "SCOPE.md",
      "repository_ref": "causal-reality-calculus",
      "content_sha": "99dcb23249b18f16044deedf234f54f473ffbd11",
      "version": "0.1",
      "author": null,
      "date": null,
      "epistemic_status": "OBSERVED",
      "capture_status": "FULL",
      "notes": [
        "Defines objective, implementation scope, compatibility requirement, and v0.1 exit criteria."
      ]
    },
    {
      "id": "gr-ai-gamma:artifact:set-calculus-provenance",
      "name": "Set Calculus Provenance",
      "aliases": [
        "PROVENANCE.md"
      ],
      "kind": "REPOSITORY_ARTIFACT",
      "locator": "PROVENANCE.md",
      "repository_ref": "causal-reality-calculus",
      "content_sha": "9e1d9ae473a1cebb88780c72fb39c0365466fac0",
      "version": null,
      "author": null,
      "date": null,
      "epistemic_status": "OBSERVED",
      "capture_status": "FULL",
      "notes": [
        "Repository-level provenance policy and historical attribution boundary."
      ]
    },
    {
      "id": "gr-ai-gamma:artifact:set-calculus-core-readme",
      "name": "Set Calculus Core README",
      "aliases": [],
      "kind": "REPOSITORY_ARTIFACT",
      "locator": "docs/set-calculus-core/README.md",
      "repository_ref": "causal-reality-calculus",
      "content_sha": "88a43d51c74a28b0cda4312b8de55c434b7c8c21",
      "version": null,
      "author": null,
      "date": null,
      "epistemic_status": "OBSERVED",
      "capture_status": "FULL",
      "notes": [
        "Canonical working source for primitive candidates and initial Set Calculus invariants."
      ]
    }
  ],
  "passages": [
    {
      "id": "gr-ai-gamma:artifact:set-calculus-readme-passage-core-pipeline",
      "source_id": "gr-ai-gamma:artifact:set-calculus-readme",
      "label": "Set Calculus core transformation pipeline",
      "location": {
        "section": "Core idea",
        "page_start": null,
        "page_end": null,
        "line_start": null,
        "line_end": null,
        "heading": "Core idea"
      },
      "capture": "STRUCTURAL",
      "summary": "input structure -> normalize -> resolve membership/relationship -> apply transform -> resolved state -> provenance",
      "epistemic_status": "OBSERVED",
      "calibration_status": "NOT_APPLICABLE",
      "unmapped_remainder": false
    },
    {
      "id": "gr-ai-gamma:artifact:idgm-primitives-passage-sc-tuple",
      "source_id": "gr-ai-gamma:artifact:idgm-primitives",
      "label": "General Set Calculus primitive tuple",
      "location": {
        "section": "General Set Calculus primitives",
        "page_start": null,
        "page_end": null,
        "line_start": null,
        "line_end": null,
        "heading": "General Set Calculus primitives"
      },
      "capture": "QUOTED",
      "summary": "SC = <Set, Member, Relationship, State, Transform, Resolution, Provenance>",
      "epistemic_status": "OBSERVED",
      "calibration_status": "NOT_APPLICABLE",
      "unmapped_remainder": false
    },
    {
      "id": "gr-ai-gamma:artifact:idgm-primitives-passage-specialization",
      "source_id": "gr-ai-gamma:artifact:idgm-primitives",
      "label": "IDGM specialization primitive tuple",
      "location": {
        "section": "Added specialization primitives",
        "page_start": null,
        "page_end": null,
        "line_start": null,
        "line_end": null,
        "heading": "Added specialization primitives"
      },
      "capture": "QUOTED",
      "summary": "IDGM = SC + <Intent, Authority, Evidence>",